{
  "id": 2912, 
  "category": "PyCon DE 2011", 
  "slug": "ideenklau-erwunscht-konzepte-aus-der-zope-welt", 
  "title": "Ideenklau erw\u00fcnscht: Konzepte aus der Zope-Welt", 
  "summary": "Der Applikations-Server Zope und die Bibliotheken in seinem Umfeld enthalten eine Vielzahl von Konzepten zur Entwicklung von Webanwendungen. In diesem Vortrag werden einige Ideen erl\u00e4utert, die es so in anderen Frameworks nicht gibt. Es bleibt aber nicht bei theoretischen \u00dcberlegungen, es werden Werkzeuge vorgestellt, die unabh\u00e4ngig von Zope sind und direkt eingesetzt werden k\u00f6nnen.", 
  "description": "", 
  "quality_notes": "", 
  "language": "German", 
  "copyright_text": "http://www.youtube.com/t/terms", 
  "thumbnail_url": "http://i1.ytimg.com/vi/35HkKlmPoxU/hqdefault.jpg", 
  "duration": null, 
  "videos": [
    {
      "url": "http://www.youtube.com/watch?v=35HkKlmPoxU", 
      "length": 0, 
      "type": "youtube"
    }
  ], 
  "source_url": "http://www.youtube.com/watch?v=35HkKlmPoxU", 
  "tags": [], 
  "speakers": [
    "Wolfgang Schnerring"
  ], 
  "recorded": "2011-10-06"
}