{
    "description": "Details: https://in.pycon.org/cfp/schedule_item/22/",
    "recorded": "",
    "speakers": [
        "https://in.pycon.org/cfp/schedule_item/22"
    ],
    "thumbnail_url": "https://i.ytimg.com/vi/LeuQ409r1hg/hqdefault.jpg",
    "title": "Sponsored - Python in Enterprise - Part2 - ZeOmega - PyCon India 2015",
    "videos": [
        {
            "type": "youtube",
            "url": "https://www.youtube.com/watch?v=LeuQ409r1hg"
        }
    ]
}
