{
  "alias": "video/3414/what-python-can-learn-from-erlang",
  "category": "PyCon US 2015",
  "copyright_text": "creativeCommon",
  "description": "",
  "duration": null,
  "id": 3414,
  "language": "English",
  "quality_notes": "",
  "recorded": "2015-04-11",
  "slug": "what-python-can-learn-from-erlang",
  "source_url": "https://www.youtube.com/watch?v=EmICpC_QmhI",
  "speakers": [
    "Benoit Chesneau"
  ],
  "summary": "",
  "tags": [],
  "thumbnail_url": "https://i.ytimg.com/vi/EmICpC_QmhI/hqdefault.jpg",
  "title": "What Python can learn from Erlang",
  "videos": [
    {
      "length": 0,
      "type": "youtube",
      "url": "https://www.youtube.com/watch?v=EmICpC_QmhI"
    }
  ]
}