{
  "id": 2624,
  "category": "PyCon US 2014",
  "slug": "django-for-web-designers-and-front-end-developers",
  "title": "Django for Web Designers and Front End Developers",
  "summary": "Traditional tutorials for Django usually assume some programming\nexperience, but what if someone is learning Python and Django with a\nHTML/CSS background? This tutorial focuses on the web-based features of\nDjango \u2014 templates and the admin \u2014 and goes over the basic building\nblocks of Django programming to get web designers excited and interested\nin learning more.\n",
  "description": "",
  "quality_notes": "",
  "language": "English",
  "copyright_text": "http://www.youtube.com/t/terms",
  "thumbnail_url": "http://i1.ytimg.com/vi/-l3ILra8ewI/hqdefault.jpg",
  "duration": null,
  "videos": [
    {
      "url": "http://www.youtube.com/watch?v=-l3ILra8ewI",
      "type": "youtube",
      "length": 0
    }
  ],
  "source_url": "http://www.youtube.com/watch?v=-l3ILra8ewI",
  "tags": [],
  "speakers": [
    "David Wolever",
    "Tracy Osborn"
  ],
  "recorded": "2014-04-12"
}