{
  "id": 1676,
  "category": "PyCon US 2013",
  "slug": "the-naming-of-ducks-where-dynamic-types-meet-sma",
  "title": "The Naming of Ducks: Where Dynamic Types Meet Smart Conventions",
  "alias": "video/1676/the-naming-of-ducks-where-dynamic-types-meet-sma",
  "summary": "While Java and C# use static type declarations to eliminate ambiguity,\nthe Python programmer must survive through sheer clarity and consistency\nin naming variables. We will explore the deep unspoken conventions that\nthe Python community has developed and honed over two decades to make\nPython code readable and meaningful within the freedom that a\ndynamically-typed language grants us.\n",
  "description": "",
  "quality_notes": "",
  "language": "English",
  "copyright_text": "CC",
  "thumbnail_url": "http://i.ytimg.com/vi/YklKUuDpX5c/hqdefault.jpg",
  "duration": null,
  "videos": [
    {
      "url": "http://s3.us.archive.org/nextdayvideo/psf/pycon2013/The_Naming_of_Ducks_Where_Dyna.mp4?Signature=drvwKQMFi5Vt2QItklKi9KnG0n8%3D&Expires=1363836226&AWSAccessKeyId=FEWGReWX3QbNk0h3",
      "type": "mp4",
      "length": null
    },
    {
      "url": "https://www.youtube.com/watch?v=YklKUuDpX5c",
      "type": "youtube",
      "length": 0
    }
  ],
  "source_url": "https://www.youtube.com/watch?v=YklKUuDpX5c",
  "tags": [
    "talk"
  ],
  "speakers": [
    "Brandon Rhodes"
  ],
  "recorded": "2013-03-15"
}