{
  "id": 1785, 
  "category": "PyCon US 2013", 
  "slug": "python-for-humans-1", 
  "title": "Python for Humans", 
  "summary": "Python\u2019s ecosystem is held up to a high standard, but it falls short in a few key areas. A handful of crucial APIs are an absolute pain to work with. We\u2019ll go over where these APIs went wrong and learn about strong and elegant API design. The high barriers to entry in Python will be discussed. Potential solutions will be proposed. ", 
  "description": "", 
  "quality_notes": "", 
  "language": "English", 
  "copyright_text": "CC", 
  "thumbnail_url": "http://i2.ytimg.com/vi/QpkHt1hDYTo/hqdefault.jpg", 
  "duration": null, 
  "videos": [
    {
      "url": "http://s3.us.archive.org/nextdayvideo/psf/pycon2013/Getting_Python_and_Django_Thro.mp4?Signature=QZTC36G3tjbxEoaC9FtitPfiptw%3D&Expires=1364652846&AWSAccessKeyId=FEWGReWX3QbNk0h3", 
      "length": null, 
      "type": "mp4"
    }, 
    {
      "url": "https://www.youtube.com/watch?v=QpkHt1hDYTo", 
      "length": 0, 
      "type": "youtube"
    }
  ], 
  "source_url": "https://www.youtube.com/watch?v=QpkHt1hDYTo", 
  "tags": [
    "talk"
  ], 
  "speakers": [
    "Kenneth Reitz"
  ], 
  "recorded": "2013-03-16"
}