{
  "id": 3915, 
  "category": "PyCon ZA 2013", 
  "slug": "panel-discussion-effective-team-practices-in-sof-0", 
  "title": "Panel discussion: Effective Team Practices in Software Development (part 2)", 
  "summary": "", 
  "description": "", 
  "quality_notes": "", 
  "language": "English", 
  "copyright_text": "http://creativecommons.org/licenses/by/3.0/", 
  "thumbnail_url": "http://archive.org/download/pyconza2013-panel-discussion-pt2/pyconza2013-panel-discussion-pt2.thumbs/pyconza2013-panel-discussion-pt2_002130.jpg", 
  "duration": null, 
  "videos": [
    {
      "url": "http://archive.org/download/pyconza2013-panel-discussion-pt2/pyconza2013-panel-discussion-pt2.ogv", 
      "length": null, 
      "type": "ogv"
    }
  ], 
  "source_url": "http://archive.org/details/pyconza2013-panel-discussion-pt2", 
  "tags": [
    "pyconza", 
    "pyconza2013"
  ], 
  "speakers": [], 
  "recorded": "2013-10-03"
}