{
  "id": 1755,
  "category": "PyCon US 2013",
  "slug": "customizing-the-django-admin-the-how-and-the-why",
  "title": "Customizing the Django Admin: The How and the Why",
  "alias": "video/1755/customizing-the-django-admin-the-how-and-the-why",
  "summary": "The abstraction and the flexibility the Django admin offers is matched\nby few software, even today after half a decade of it's introduction.\nThe speaker has customized it in many ways over the years. This talk\nreminisces over how supposedly large real world problems could be solved\nwith relatively less development by leveraging the power of django admin\nand using a few techniques.\n",
  "description": "",
  "quality_notes": "",
  "language": "English",
  "copyright_text": "CC",
  "thumbnail_url": "http://i.ytimg.com/vi/ICgMg70aV7U/hqdefault.jpg",
  "duration": null,
  "videos": [
    {
      "url": "http://s3.us.archive.org/nextdayvideo/psf/pycon2013/Customizing_the_Django_Admin_T.mp4?Signature=bePdKYypv64MNXR1dAraGIqRbZc%3D&Expires=1363662766&AWSAccessKeyId=FEWGReWX3QbNk0h3",
      "type": "mp4",
      "length": null
    },
    {
      "url": "https://www.youtube.com/watch?v=ICgMg70aV7U",
      "type": "youtube",
      "length": 0
    }
  ],
  "source_url": "https://www.youtube.com/watch?v=ICgMg70aV7U",
  "tags": [
    "talk"
  ],
  "speakers": [
    "Lakshman Prasad"
  ],
  "recorded": "2013-03-16"
}