{
  "id": 977,
  "category": "PyCon AU 2011",
  "slug": "lightning-talks-sunday-and-conference-close",
  "title": "Lightning talks: Sunday and Conference Close",
  "summary": "Lightning talks Sunday.\n",
  "description": "",
  "quality_notes": "",
  "language": "English",
  "copyright_text": "Creative Commons Attribution license",
  "thumbnail_url": "http://i.ytimg.com/vi/B7MD6-nSfrU/hqdefault.jpg",
  "duration": null,
  "videos": [
    {
      "url": "http://www.youtube.com/watch?v=B7MD6-nSfrU",
      "type": "youtube",
      "length": 0
    }
  ],
  "source_url": "http://www.youtube.com/watch?v=B7MD6-nSfrU",
  "tags": [
    "conference"
  ],
  "speakers": [],
  "recorded": "2011-08-23"
}