{
  "id": 517,
  "category": "PyOhio 2010",
  "slug": "pyohio-2010--wrangling-the-bits--standardizing-ho",
  "title": "PyOhio 2010: Wrangling the bits, standardizing how apps get built",
  "summary": "",
  "description": "Wrangling the bits, standardizing how apps get built\n\nPresented by Rick Harding\n\nAs we moved more work to Python we had to figure out how to start,\nshare, and deploy projects in a standard way. Virtualenv, pip, and Git\nto the rescue.\n\n[Note: The talk starts at around 7:20 when the mic is working.]\n",
  "quality_notes": "",
  "language": "English",
  "copyright_text": "Creative Commons Attribution-NonCommercial-ShareAlike 3.0",
  "thumbnail_url": "http://a.images.blip.tv/Pyohio-WranglingTheBitsStandardizingHowAppsGetBuilt608.png",
  "duration": null,
  "videos": [
    {
      "url": "http://05d2db1380b6504cc981-8cbed8cf7e3a131cd8f1c3e383d10041.r93.cf2.rackcdn.com/pyohio-2010/517_pyohio-2010-wrangling-the-bits-standardizing-how-apps-get-built.flv",
      "type": "flv",
      "length": null
    }
  ],
  "source_url": "",
  "tags": [
    "deploying",
    "fabric",
    "git",
    "pip",
    "pyohio",
    "pyohio2010",
    "virtualenv"
  ],
  "speakers": [
    "Rick Harding"
  ],
  "recorded": null
}