{
  "id": 1664,
  "category": "PyCon US 2013",
  "slug": "pyramid-for-humans",
  "title": "Pyramid for Humans",
  "alias": "video/1664/pyramid-for-humans",
  "summary": "Pyramid has emerged as a fast, modern, lightweight web framework. This\nlively, hands-on tutorial covers a little about a lot: practical\nintroductions to the most common facilities. Fun, fast-paced, and most\ncertainly not aimed at experts.\n",
  "description": "",
  "quality_notes": "",
  "language": "English",
  "copyright_text": "CC",
  "thumbnail_url": "http://i.ytimg.com/vi/0CP7Cv4G6x0/hqdefault.jpg",
  "duration": null,
  "videos": [
    {
      "url": "http://s3.us.archive.org/nextdayvideo/psf/pycon2013/Pyramid_for_Humans.mp4?Signature=4AdEu7Qqi5cwSAys7J48W8QLQ%2FA%3D&Expires=1363917984&AWSAccessKeyId=FEWGReWX3QbNk0h3",
      "type": "mp4",
      "length": null
    },
    {
      "url": "https://www.youtube.com/watch?v=0CP7Cv4G6x0",
      "type": "youtube",
      "length": 0
    }
  ],
  "source_url": "https://www.youtube.com/watch?v=0CP7Cv4G6x0",
  "tags": [
    "tutorial"
  ],
  "speakers": [
    "Paul Everitt"
  ],
  "recorded": "2013-03-13"
}