{
  "description": "Большинство разработчиков пишут тесты с помощью стандартной библиотеки unittest и довольны жизнью. Я тоже был из таких - пока не начал интенсивно использовать py.test.\n\nК сожалению, библиотека недостаточно популяризирована, и мы попробуем восполнить этот недостаток.\n\nВ докладе речь пойдет о написании pytest fixtures (основном инструменте расширения), добавлении конфигурационных параметров, написании plugins и прочих полезных штуках.\n",
  "duration": 2577,
  "recorded": "2016-07-03",
  "speakers": [
    "Andrew Svetlov"
  ],
  "thumbnail_url": "https://i.ytimg.com/vi/7KgihdKTWY4/hqdefault.jpg",
  "title": "Продвинутое использование py.test",
  "videos": [
    {
      "type": "youtube",
      "url": "https://www.youtube.com/watch?v=7KgihdKTWY4"
    }
  ]
}
