{
  "id": 3182, 
  "category": "PyTexas 2014", 
  "slug": "graph-databases-via-networkx", 
  "title": "Graph Databases via Networkx", 
  "summary": "", 
  "description": "Graph databases are a different way to approach your data.  I'll be talking about techniques from social network analysis to do some toy problems to get you thinking in a different direction using a library called Networkx.", 
  "quality_notes": "", 
  "language": "English", 
  "copyright_text": "CC-BY", 
  "thumbnail_url": "http://i.ytimg.com/vi/HCre6aYeEKc/hqdefault.jpg", 
  "duration": 1500, 
  "videos": [
    {
      "url": "http://64966d3674e0a64d8f4a-47c94b14ef8e1f83d5390cdb0629c6ed.r53.cf2.rackcdn.com/pytexas-2014/3182_Graph_Databases_via_Networkx.webm", 
      "length": null, 
      "type": "webm"
    }, 
    {
      "url": "http://youtu.be/HCre6aYeEKc", 
      "length": 0, 
      "type": "youtube"
    }
  ], 
  "source_url": "http://youtu.be/HCre6aYeEKc", 
  "tags": [], 
  "speakers": [
    "Jeremy Langley"
  ], 
  "recorded": "2014-10-04"
}