{
  "id": 887, 
  "category": "PyCon US 2012", 
  "slug": "a-gentle-introduction-to-gis", 
  "title": "A Gentle Introduction to GIS", 
  "summary": "Datums! Coordinate systems! Map projections! Topologies! Spatial applications\nare a nebulous, daunting concept to most Pythonistas. This talk is a gentle\nintroduction into the concepts, terminology and tools to demystify the world\nof the world.\n\n", 
  "description": "", 
  "quality_notes": "", 
  "language": "English", 
  "copyright_text": "", 
  "thumbnail_url": "http://img.youtube.com/vi/LddeJ06JoXE/hqdefault.jpg", 
  "duration": null, 
  "videos": [
    {
      "url": "https://www.youtube.com/watch?v=LddeJ06JoXE", 
      "length": 0, 
      "type": "youtube"
    }
  ], 
  "source_url": "https://www.youtube.com/watch?v=LddeJ06JoXE", 
  "tags": [], 
  "speakers": [
    "Jason Scheirer"
  ], 
  "recorded": "2012-03-10"
}