{
  "id": 2653, 
  "category": "PyCon US 2014", 
  "slug": "dynamics-and-control-with-python", 
  "title": "Dynamics and Control with Python", 
  "summary": "In this tutorial we will first learn how to solve, simulate, and visualize multibody dynamics problems with Python. These methods and techniques play an important role in the design of robots, vehicles, spacecraft, manufacturing machines, etc.", 
  "description": "", 
  "quality_notes": "", 
  "language": "English", 
  "copyright_text": "http://www.youtube.com/t/terms", 
  "thumbnail_url": "http://i1.ytimg.com/vi/IoMR-ESzqw8/hqdefault.jpg", 
  "duration": null, 
  "videos": [
    {
      "url": "http://www.youtube.com/watch?v=IoMR-ESzqw8", 
      "length": 0, 
      "type": "youtube"
    }
  ], 
  "source_url": "http://www.youtube.com/watch?v=IoMR-ESzqw8", 
  "tags": [], 
  "speakers": [
    "Jason Moore", 
    "Tarun Gaba"
  ], 
  "recorded": "2014-04-12"
}