{
  "id": 3809, 
  "category": "PyGotham 2015", 
  "slug": "large-scale-non-linear-learning-on-a-single-cpu", 
  "title": "Large scale non-linear learning on a single CPU", 
  "summary": "", 
  "description": "This talk presents several methods for learning non-linear models on a single machine, where the dataset does not fit into ram. It will cover the hashing trick, kernel approximations, neural networks, and extreme learning machines (random neural networks).\r\nThis will be a fairly technical talk, showing off some of the lesser known out-of-core capabilities of scikit-learn.", 
  "quality_notes": "", 
  "language": "English", 
  "copyright_text": "CC BY-SA", 
  "thumbnail_url": "https://i.ytimg.com/vi/l43VIw5xhTg/hqdefault.jpg", 
  "duration": 1519, 
  "videos": [
    {
      "url": "http://64966d3674e0a64d8f4a-47c94b14ef8e1f83d5390cdb0629c6ed.r53.cf2.rackcdn.com/pygotham-2015/3809_Large_scale_nonlinear_learning_on_a_single_CPU.mp4", 
      "length": null, 
      "type": "mp4"
    }, 
    {
      "url": "http://youtu.be/l43VIw5xhTg", 
      "length": 0, 
      "type": "youtube"
    }
  ], 
  "source_url": "http://youtu.be/l43VIw5xhTg", 
  "tags": [], 
  "speakers": [
    "Andreas Mueller"
  ], 
  "recorded": "2015-08-16"
}