{
  "id": 1647,
  "category": "PyCon AU 2012",
  "slug": "visualising-architecture",
  "title": "Visualising architecture",
  "summary": "Architecture. It's an oxymoron all by itself, and using Python is no\nsilver bullet to the perennial problem of code rot and design\ncomplexity. How does complexity bite us in practise? What tools exist to\nsimplify and explain arc\n",
  "description": "Architecture. It's an oxymoron all by itself, and using Python is no\nsilver bullet to the perennial problem of code rot and design\ncomplexity. How does complexity bite us in practise? What tools exist to\nsimplify and explain architecture? Is anybody doing this right? This\ntalk will cover some tools that exist for visualising Python codebases,\nexamining architectures and how to deal with things in practise.\n",
  "quality_notes": "",
  "language": "English",
  "copyright_text": "http://www.youtube.com/t/terms",
  "thumbnail_url": "http://i.ytimg.com/vi/vOyF_LDeXTc/hqdefault.jpg",
  "duration": null,
  "videos": [
    {
      "url": "http://www.youtube.com/watch?v=vOyF_LDeXTc",
      "type": "youtube",
      "length": 0
    }
  ],
  "source_url": "http://www.youtube.com/watch?v=vOyF_LDeXTc",
  "tags": [],
  "speakers": [
    "Tennessee Leeuwenburg"
  ],
  "recorded": "2012-08-21"
}