{
  "id": 2475, 
  "category": "DjangoCon EU 2010", 
  "slug": "djangoconeu-seanoconnor982flv", 
  "title": "Djangoconeu-SeanOConnor982.flv", 
  "summary": "", 
  "description": "", 
  "quality_notes": "", 
  "language": "English", 
  "copyright_text": "", 
  "thumbnail_url": null, 
  "duration": null, 
  "videos": [
    {
      "url": "http://05d2db1380b6504cc981-8cbed8cf7e3a131cd8f1c3e383d10041.r93.cf2.rackcdn.com/djangocon-eu-2010/Djangoconeu-SeanOConnor982.flv", 
      "length": null, 
      "type": "flv"
    }
  ], 
  "source_url": null, 
  "tags": [], 
  "speakers": [], 
  "recorded": null
}